name,ring,quadrant,isNew,description
Data Mesh,Adopt,Techniques,TRUE,"Data mesh is an architectural and organizational paradigm shift in how we manage big analytical data. The paradigm is founded on four principles: (1) domain-oriented decentralization of data ownership and architecture; (2) domain-oriented data served as a product; (3) self-serve data infrastructure as a platform to enable autonomous, domain-oriented data teams; and (4) federated governance to enable ecosystems and interoperability. At GBG it goes beyond analytical data, to extend across the many differnt data sources we utilise. By setting out the principles through which data is acquired, managed and retrieved, it allows to build product services that effectively combine multiple data sources, internal and external, to provide data-driven services. "
Run cost as architecture fitness function,Trial,Techniques,TRUE,"Automating the estimation, tracking and projection of cloud infrastructure's run cost is necessary for today's organizations. The cloud providers' savvy pricing models, combined with the proliferation of pricing parameters and the dynamic nature of today's architecture, can lead to surprisingly expensive run costs. For example, the price of serverless based on API calls, event streaming solutions based on traffic or data processing clusters based on running jobs, all have a dynamic nature that changes over time as the architecture evolves. When our teams manage infrastructure on the cloud, implementing run cost as architecture fitness function is one of their early activities. This means that our teams can observe the cost of running services against the value delivered; when they see deviations from what was expected or acceptable, they'll discuss whether it's time to evolve the architecture. The observation and calculation of the run cost is implemented as an automated function."
Figma,Adopt,Tools,FALSE,"Go-to tool for collaborative design, not only for designers but for multidisciplinary teams too; it allows developers and other roles to view and comment on designs through the browser without the desktop version. Compared to its competitors (e.g., Invision or Sketch) which have you use more than one tool for versioning, collaborating and design sharing, Figma puts together all of these features in one tool that makes it easier for our teams to discover new ideas together. Our teams find Figma very useful, especially in remote and distributed design work enablement and facilitation. In addition to its real-time design and collaboration capabilities, Figma also offers an API that helps to improve the DesignOps process."
Terraform,Adopt,Tools,FALSE,"Terraform, is rapidly becoming a de facto choice for creating and managing cloud infrastructures by writing declarative definitions. Already used across many teams in GBG and championed by the Cloud Infrastructure team it is our current infrastructure-as-code tool of choice. "
Neo4j,Adopt,Tools,FALSE,"Neo4j is an open-source, NoSQL, native graph database that provides is ACID-compliant."
Apache Solr,Assess,Tools,FALSE,"Apache Solr (Searching On Lucene w/ Replication) is a free, open-source search engine based on the Apache Lucene library. An Apache Lucene subproject, it has been available since 2004 and is one of the most popular search engines available today worldwide. Solr, however, is more than a search engine — it’s also often used as a document-based NoSQL database with transactional support that can be used for storage purposes and even a key-value store."
Jupyter Notebook,Adopt,Tools,TRUE,"The Jupyter Notebook is an open-source web application that allows you to create and share documents that contain live code, equations, visualizations and narrative text. Uses include: data cleaning and transformation, numerical simulation, statistical modeling, data visualization, machine learning."
Redis,Adopt,Tools,FALSE,"Redis is an open source (BSD licensed), in-memory data structure store, used as a database, cache, and message broker. Redis provides data structures such as strings, hashes, lists, sets, sorted sets with range queries, bitmaps, hyperloglogs, geospatial indexes, and streams. Redis has built-in replication, Lua scripting, LRU eviction, transactions, and different levels of on-disk persistence, and provides high availability via Redis Sentinel and automatic partitioning with Redis Cluster"
SonarQube,Adopt,Tools,FALSE,"SonarQube is an open-source platform developed by SonarSource for continuous inspection of code quality to perform automatic reviews with static analysis of code to detect bugs, code smells, and security vulnerabilities on 20+ programming languages."
Rest Assured,Adopt,Tools,FALSE,Java based RETS API testing tool
SoapUI,Adopt,Tools,FALSE,API testing tool
Selenium,Adopt,Tools,FALSE,"Selenium is a free (open-source) automated testing framework used to validate web applications across different browsers and platforms. You can use multiple programming languages like Java, C#, Python etc to create Selenium Test Scripts. "
Jmeter,Adopt,Tools,TRUE,"Apache JMeter is an Apache project that can be used as a load testing tool for analyzing and measuring the performance of a variety of services, with a focus on web applications."
Fluentd,Adopt,Tools,FALSE,​Fluentd is an open-source data collector for a unified logging layer. Fluentd allows you to unify data collection and consumption for better use and understanding of data.
Kafka,Adopt,Tools,TRUE,"Apache Kafka is a  distributed event streaming platform. Initially conceived as a messaging queue, Kafka is based on an abstraction of a distributed commit log. Since being created and open sourced by LinkedIn in 2011, Kafka has quickly evolved from messaging queue to a full-fledged event streaming platform that is widely adopted and often used in Event Streaming and Event Sourcing architectures."
OpenTelemetry (Tracing),Assess,Tools,TRUE,"A CNCF incubating project that brings together OpenTracing and OpenCensus projects. It is open-source, vendor neutral specification for  tracing, metrics and logs. The v1.0 specification provides an API and SDK defintion for tracing with the other components to follow. "
Open Policy Agent (OPA),Assess,Tools,TRUE,"The Open Policy Agent (OPA) is an open source, general-purpose policy engine that unifies policy enforcement across the stack. OPA provides a high-level declarative language that lets you specify policy as code and simple APIs to offload policy decision-making from your software."
Great Expectations,Assess,Tools,TRUE,"open source tool to help data teams eliminate pipeline debt, through data testing, documentation, and profiling"
DBT ,Assess,Tools,TRUE,command-line tool that enables data analysts and engineers to transform data in their warehouses simply by writing select statements
Cassandra,Assess,Tools,TRUE,"Distributed database engine, column-based, could be a way to simplify stacks where coexits several relational and no-sql databases"
Enterprise Architect,Assess,Tools,TRUE,Visual modeling and design tool based on the OMG UML
Micro Focus ALM,Assess,Tools,TRUE,Set of software tools developed and marketed by Micro Focus (previously Hewlett-Packard and Hewlett Packard Enterprise) for application development and testing
XRay,Assess,Tools,TRUE,"Test case management tool, integrates well with JIRA making test and results located in single location consumable by users and stakeholders"
Zeppelin,Hold,Tools,TRUE,Open-source notebook application which has become less popular than Jupyter
Camunda,Hold,Tools,FALSE,"a powerful open-source workflow and decision automation platform. The Camunda engine cloud version is not compatioble with the current server deployment, it is best to see which version will gain tranaction before considering usage."
Elastic Common Schema,Hold,Tools,TRUE,"ECS is an open source specification that defines a common set of document fields for log events most commonly ingested into ElasticSearch. Every component has their won naming conventiobnts for data attributes, complicating ingestion rules and hindering cross componenet analysis without transformation. The adoption of a common schema mitigates these issues. There is a lack of competing schemas and with Elastic's expanding market penetration it is a good shcema to implement today, knowing it will be most likley supported well across vendors tomorrow.
The Identity Logging Working Group has used ECS as the basis for their work. "
Sentry,Trial,Tools,TRUE,"Self-hosted and cloud-based error monitoring that helps software teams discover, triage, and prioritize errors in real-time that is especially popular for frontend error reporting."
Apache Airflow,Adopt,Tools,TRUE,open-source workflow management tool for data-processing pipelines as directed acyclic graphs (DAGs)
Avro,Trial,Tools,TRUE,"Apache Avro is a data serialization system. Avro provides: Rich data structures. A compact, fast, binary data format. A container file, to store persistent data"
Ping Identity,Adopt,Platforms,TRUE,Ping Identity provides federated identity management and self-hosted identity access management (IAM) solutions to web identities and single sign-on solutions. It is the chosen IAM provider for GBG solutions. 
Rollup,Assess,Languages & Frameworks,TRUE,Build tool for bundling javascript and css distributions
Node.js,Adopt,Languages & Frameworks,FALSE,"Event-driven, non-blocking I/O framework"
TypeScript,Adopt,Languages & Frameworks,TRUE,Static typing for JavaScript
Google Cloud Platform,Adopt,Platforms,TRUE,Cloud computing platform
BDD,Adopt,Techniques,TRUE,Behavioural driven development
CockRoach DB,Assess,Tools,TRUE,Distributed / Localised database
Sumo Logic,Adopt,Tools,TRUE,Monitoring for front end errors
Kibana,Adopt,Tools,TRUE,Tool for visualising textual data including logs
ML or Model Ops,Adopt,Techniques,TRUE,MLOps/ModelOps is the process of taking an experimental Machine Learning or AI model into a production system.
The Go Programming Language,Adopt,Languages & Frameworks,TRUE,"Go is a statically typed, compiled programming language designed at Google by Robert Griesemer, Rob Pike, and Ken Thompson. Go is syntactically similar to C, but with memory safety, garbage collection, structural typing, and CSP-style concurrency"
Apache Arrow,Assess,Languages & Frameworks,TRUE,Apache Arrow is a language-agnostic software framework for developing data analytics applications that process columnar data. It contains a standardized column-oriented memory format that is able to represent flat and hierarchical data for efficient analytic operations on modern CPU and GPU hardware
Pachyderm,Assess,Platforms,TRUE,Pachyderm is the data layer that powers your machine learning lifecycle
Postgres,Adopt,Tools,FALSE,"PostgreSQL is a powerful, open source object-relational database system with over 30 years of active development that has earned it a strong reputation for reliability, feature robustness, and performance."
Julia,Trial,Languages & Frameworks,TRUE,"Julia is a high-level, high-performance, dynamic programming language. While it is a general-purpose language and can be used to write any application, many of its features are well suited for numerical analysis and computational science."
Netdata,Assess,Tools,TRUE,"Netdata is an open source tool designed to collect real-time metrics, such as CPU usage, disk activity, bandwidth usage, website visits, etc., and then display them in live, easy-to-interpret charts."
Flutter,Assess,Languages & Frameworks,TRUE,"Flutter is an open-source UI software development kit created by Google. It is used to develop cross platform applications for Android, iOS, Linux, Mac, Windows, Google Fuchsia, and the web from a single codebase. The first version of Flutter was known as codename ""Sky"" and ran on the Android operating system"
Snowflake,Assess,Tools,TRUE,"Snowflake is a data warehouse built on top of the Amazon Web Services or Microsoft Azure cloud infrastructure. There’s no hardware or software to select, install, configure, or manage, so it’s ideal for organizations that don’t want to dedicate resources for setup, maintenance, and support of in-house servers."
KISS Principle,Adopt,Techniques,TRUE,"KISS, an acronym for keep it simple, stupid, is a design principle noted by the U.S. Navy in 1960. The KISS principle states that most systems work best if they are kept simple rather than made complicated; therefore, simplicity should be a key goal in design, and unnecessary complexity should be avoided."
Jenkins,Adopt,Tools,TRUE,"Jenkins – an open source automation server which enables developers around the world to reliably build, test, and deploy their software."
K3s,Trial,Tools,TRUE,"K3s is a highly available, certified Kubernetes distribution designed for production workloads in unattended, resource-constrained, remote locations or inside IoT appliances."
Traefik,Adopt,Tools,TRUE,Traefik is an open-source Edge Router that makes publishing your services a fun and easy experience. It receives requests on behalf of your system and finds out which components are responsible for handling them.
GraphQL,Trial,Languages & Frameworks,TRUE,"GraphQL is an open-source data query and manipulation language for APIs, and a runtime for fulfilling queries with existing data. GraphQL was developed internally by Facebook in 2012 before being publicly released in 2015."