name,ring,quadrant,isNew,description
Python,Adopt,Languages & Frameworks,FALSE,"cross platform open source programming language that is useful for scripting, data science applications and serverless. It is not a recommended language for middleware applications and API services."
Spark,Adopt,Languages & Frameworks,TRUE,"Apache Spark is a unified analytics engine for big data processing, with built-in modules for streaming, SQL, machine learning and graph processing"
C#,Adopt,Languages & Frameworks,FALSE,"C# is a general-purpose, multi-paradigm programming language encompassing static typing, strong typing, lexically scoped, imperative, declarative, functional, generic, object-oriented, and component-oriented programming disciplines."
Scala 3,Assess,Languages & Frameworks,TRUE,"JVM language that combines both Object-Oriented Programming and Functional Programming, especially used in big data projects."
OpenAPI v3 (Swagger),Adopt,Languages & Frameworks,FALSE,"The OpenAPI Specification (OAS) defines a standard, language-agnostic interface to RESTful APIs which allows both humans and computers to discover and understand the capabilities of the service without access to source code, documentation, or through network traffic inspection. When properly defined, a consumer can understand and interact with the remote service with a minimal amount of implementation logic. It is preferred over other specifications such as RAML due to superior support in tooling and platforms."
React,Adopt,Languages & Frameworks,FALSE,"React is a declarative, efficient, and flexible JavaScript library for building user interfaces. It lets you compose complex UIs from small and isolated pieces of code called “components”. It's one of the most popular JS frameworks around and used within GBG as well as Angular"
Webpack,Adopt,Languages & Frameworks,FALSE,Build tool for creating javascript and css distributions
gRPC,Adopt,Languages & Frameworks,TRUE," gRPC is a modern open source high performance Remote Procedure Call (RPC) framework that can run in any environment. It can efficiently connect services in and across data centers with pluggable support for load balancing, tracing, health checking and authentication. It is increasingly used for internal API, with supoprt in service meshes etc increasing. "
Kotlin,Adopt,Languages & Frameworks,TRUE,"a cross-platform, statically typed, general-purpose programming language. Preferred language for Android within GBG"
Swift,Adopt,Languages & Frameworks,TRUE,"Swift is a general-purpose, multi-paradigm, compiled programming language developed by Apple. It's only recommended for iOS development within GBG."
Specflow,Adopt,Languages & Frameworks,TRUE,"open source framework for Behavior Driven Development, Acceptance Test Driven Development and Specification by Example"
Angular,Adopt,Languages & Frameworks,FALSE,Angular is a platform and framework for building single-page client applications using HTML and TypeScript. 
PyTorch,Adopt,Languages & Frameworks,TRUE,"open source machine learning library based on the Torch library, used for applications such as computer vision and natural language processing"
Tensorflow,Adopt,Languages & Frameworks,TRUE,An end-to-end platform for ML. It enables to build and deploy ML powered applications.
.NET Core,Adopt,Languages & Frameworks,FALSE,cross-platform successor to .NET Framework
FlameGraph,Adopt,Languages & Frameworks,FALSE,"Visualization of profiled software, allowing the most frequent code-paths to be identified quickly and accurately."
GBG Design System,Adopt,Languages & Frameworks,TRUE,GBG's own design system and component library: http://ds.gbgplc.com/
Rust,Adopt,Languages & Frameworks,TRUE,"Rust is a multi-paradigm programming language designed for performance and safety, especially safe concurrency. It has been voted ""most loved"" language 5 years in a row by StackOverflow users. Recommended to assess as alternative to  C++."
React Native,Assess,Languages & Frameworks,TRUE,cross-platform open-source mobile application framework created by FaceBook based on React.js 
Bash/Powershell Scripting,Hold,Languages & Frameworks,FALSE,Bash has been the defacto shell in Linux for many years as has PowerShell on Windows. However both lack features that more fully fledged scripting languages do support and is not recommnded for anything but trivial scripting. Python is a better alternative.
Redux,Hold,Languages & Frameworks,TRUE,Open source system for state managment
Play,Hold,Languages & Frameworks,TRUE,Strict framework based on run time dependency injection as Spring
Vue.JS,Hold,Languages & Frameworks,FALSE,Currently both Angular and React are used across GBG and both have enough traction and healthy communities to maintain on these two choices rather than extending it with a third.
React Hooks,Adopt,Languages & Frameworks,TRUE,"More modern approach to state managment, less boilerplate code than Redux"
Electron,Trial,Languages & Frameworks,FALSE,open-source software framework for the development of desktop GUI applications using web technologies such as Javascript HTML and CSS
.NET Framework,Hold,Languages & Frameworks,FALSE,Microsoft has unified .NET Framework and .NET Core under .NET 5 and going forward will not create new version of .NET Framework
C++,Hold,Languages & Frameworks,FALSE,"A number of components used are built using C++. Typically in situation where performance is a concern C++ is a reasonable choice. However in recent years alternatives have started to surface and support within GBG has started to decrease. 
C++ is put in the Hold category to signify new developments should look towards alternatives if possibl. However C++ has incredible longevity and should be used where  it is appropriate."
Github Enterprise,Adopt,Platforms,TRUE,GitHub's enterprise web-based Git repository hosting service and standard repository for all GBG Tehcnology teams.
Azure DevOps,Assess,Platforms,TRUE,MicroSoft's DevOps suite that provides CI/CD workflow features.
Kubernetes,Adopt,Platforms,TRUE,"Kubernetes is a portable, extensible, open-source platform for managing containerized workloads and services, that facilitates both declarative configuration and automation."
Docker,Adopt,Platforms,TRUE,Well known platform that use OS-level virtualization to deliver software in containers.
New Relic,Adopt,Platforms,FALSE,New Relic is an observability platform that is used fro APM and log monitoring and alerting.
AWS,Adopt,Platforms,TRUE,"Amazon Web Service is the worlds largest cloud computing platform, known for low-cost, extensive global reach and a very extensive service catalogue. It hosts many of GBG's products and services."
Azure,Adopt,Platforms,TRUE,"Microsoft Azure is the cloud platform of choice for enterprise workloads that benefit from the extensive  tooling for monitoring, security and governance available through Microsofts enterprise experience. "
Databricks,Assess,Platforms,TRUE,"Databricks is an industry-leading, cloud-based data engineering tool used for processing and transforming massive quantities of data and exploring the data through machine learning models. It is cloud-ahnostic and support R, Python, Scala and SQL"
Istio,Adopt,Platforms,TRUE,Istio is an open source service mesh—a modernized service networking layer that provides a transparent and language-independent way to flexibly and easily automate application network functions. It is a popular solution for managing the different microservices that make up a cloud-native application. Istio service mesh also supports how those microservices communicate and share data with one another.
Delta Lake,Assess,Platforms,TRUE,"Delta Lake is an open source storage layer that brings reliability to data lakes. Delta Lake provides ACID transactions, scalable metadata handling, and unifies streaming and batch data processing. Delta Lake runs on top of your existing data lake and is fully compatible with Apache Spark APIs"
Pulumi,Assess,Platforms,TRUE,"Pulumi's open source infrastructure as code SDK enables you to create, deploy, and manage infrastructure on any cloud, using your favorite languages. The ability to define infrastructure using fully fledged languages give it an advantage over Terraform in dynamic environments and make it easier to test with Pulumi. It's similar to AWS CDK but cloud-neutral."
Apache Superset,Assess,Platforms,TRUE,open-source software cloud-native application for data exploration and data visualization able to handle data at petabyte scale
Apache Griffin,Assess,Platforms,TRUE,"Apache Griffin is an open source Data Quality solution for Big Data, which supports both batch and streaming mode. It offers a set of well-defined data quality domain model, which covers most of data quality problems in general. It also define a set of data quality DSL to help users define their quality criteria. "
Apache Flink,Assess,Platforms,TRUE,"Apache Flink is an open-source, unified stream-processing and batch-processing framework developed by the Apache Software Foundation. "
AWS ElasticSearch,Hold,Platforms,TRUE,"AWS's managed ElasticSearch offering was recently targeted by a code license change by ELasticSearch's owners, which has prompted AWS to fork ElasticSearch. Although backwards compatibility is promised and it might develop into a superior service, until more information on AWS's plans with their own fork are made public, we advice to hold on using this managed service. "
Homemade infrastructure-as-code (IaC) products,Hold,Platforms,FALSE,"Products supported by companies or communities are in constant evolution, at least the ones that get traction in the industry. Sometimes organizations tend to build frameworks or abstractions on top of the existing external products to cover very specific needs, thinking that the adaptation will provide more benefits than the existing ones. Organizations trying to create homemade infrastructure-as-code (IaC) products on top of the existing ones; they underestimate the required effort to keep those solutions evolving according to their needs, and after a short period of time, they realize that the original version is in much better shape than their own; there are even cases where the abstraction on top of the external product reduces the original capabilities. Although we've seen success stories of organizations building homemade solutions, we want to caution about this approach as the effort required to do so isn't negligible, and a long-term product vision is required to have the expected outcomes."
OpenFaaS etc,Hold,Platforms,FALSE,"Projects such as OpenFaaS that aim to create cloud agnostic serveless frameworks typically need execution of these framewoirks on self managed kubernetes clusters. The overhead and a feature set which lags cloud-native implementations, mean it's currently better to pick a serverless impementation such as AWS Lambda or Azure Funtions."
Github Actions,Trial,Platforms,TRUE,"GitHub Actions are CI/CD workflow features build directly into GitHub. As all repositories migrate to GitHUb Enterprise it could be a lightweight alternative to Azure DevOps, with good integration into all repositories."
AWS Fargate,Trial,Platforms,TRUE,"AWS Fargate is a serverless compute engine for containers that works with both Amazon Elastic Container Service (ECS) and Amazon Elastic Kubernetes Service (EKS). Fargate makes it easy for you to focus on building your applications. Fargate removes the need to provision and manage servers, lets you specify and pay for resources per application, and improves security through application isolation by design. "
Managed Kubernetes orxhestartion services,Trial,Platforms,TRUE,"Managed service that you can use to run Kubernetes without needing to install, operate, and maintain your own Kubernetes control plane or nodes. Examples are AWS EKS, GCP GKE and Azure AKS."
Elastic ElasticSearch (SIEM/APM),Trial,Platforms,TRUE,"Managed ElasticSearch service offered by the creators of ElasticSearch. It's benefits are being kept up to date with latest versions of the Elastic components and only charging for compute rather than storage, which is unusual for SIEM solutions."
OpenTelemetry,Trial,Platforms,TRUE,"A CNCF- backed open source observability framework for cloud-native software. OpenTelemetry is a collection of tools, APIs, and SDKs. You can use it to instrument, generate, collect, and export telemetry data (metrics, logs, and traces) for analysis in order to understand your software's performance and behavior. Currently in Beta, but with extensive language support and ecosystem. "
Zero-Trust Architecture,Adopt,Techniques,TRUE,ZTA is a paradigm shift in security architecture and strategy. Its based on the assumption that a network perimeter is no longer representative of a secure boundary and no implicit trust should be granted to users or services based solely on their physical or network location. 
Infrastructure-as-code,Adopt,Techniques,TRUE,"Infrastructure as code is the process of managing and provisioning computer data centers through machine-readable definition files, rather than physical hardware configuration or interactive configuration tools."
Microservices,Adopt,Techniques,TRUE,"Approach to developing a single application as a suite of small services, each running in its own process and communicating with lightweight mechanisms, often an HTTP resource API. These services are built around business capabilities and independently deployable by fully automated deployment machinery. There is a bare minimum of centralized management of these services, which may be written in different programming languages and use different data storage technologies."
SPA,Adopt,Techniques,TRUE,"A single-page application (SPA) is a web application or website that interacts with the user by dynamically rewriting the current web page with new data from the web server, instead of the default method of a web browser loading entire new pages. It goes well with the microservices architecture that exposes APIs as their main interface. This technique is further evolved with Micro Frontends also in this radar."
Pipelines for infrastructure ,Adopt,Techniques,TRUE,"The use of pipelines for infrastructure as code lets you find errors before changes are applied to operational environments — including environments used for development and testing. They also offer a way to ensure that infrastructure tooling is run consistently, using CI/CD agents rather than individual workstations."
TDD,Adopt,Techniques,TRUE,"Test-driven development (TDD) is a software development process relying on software requirements being converted to test cases before software is fully developed, and tracking all software development by repeatedly testing the software against all test cases."
Continuous Delivery,Adopt,Techniques,TRUE,"Continuous Delivery is a software development discipline where you build software in such a way that the software can be released to production at any time.

You’re doing continuous delivery when: 

Your software is deployable throughout its lifecycle
Your team prioritizes keeping the software deployable over working on new features
Anybody can get fast, automated feedback on the production readiness of their systems any time somebody makes a change to them
You can perform push-button deployments of any version of the software to any environment on demand"
Event-driven architecture,Adopt,Techniques,TRUE,"Event-driven architecture (EDA) is a software architecture paradigm promoting the production, detection, consumption of, and reaction to events. An event can be defined as ""a significant change in state"". For example, when a consumer purchases a car, the car's state changes from ""for sale"" to ""sold""."
Feature toggles/flags,Adopt,Techniques,TRUE,"A feature toggle is a software development process used to enable or disable functionality remotely without deploying code. New features can be deployed without making them visible to users. Feature flags help decouple deployment from release letting you manage the full lifecycle of a feature.
Their purpose is to use known information to control how code works. For example, if new features are made available to internal users for testing and feedback, a feature flag can control this access. Any employee logged into the application with a corporate email address will see the feature; other users do not.
Feature flags eliminate the need to maintain multiple feature branches within your source code. All code changes can be made to the primary branch, only when the feature is ready will it be enabled via the flag.
To prevent complex capability matrices from spawning, toggles should be removed as soon as a feature has been adopted. Differential usage for the user population should be managed using permissions long-term."
Role-Based Access Control,Adopt,Techniques,TRUE,"Role-based access control (RBAC) is a policy-neutral access-control mechanism defined around roles and privileges. The components of RBAC such as role-permissions, user-role and role-role relationships make it simple to perform user assignments."
Service mesh,Assess,Techniques,TRUE,"A service mesh is a configurable, low‑latency infrastructure layer designed to handle a high volume of network‑based interprocess communication among application infrastructure services using application programming interfaces (APIs). A service mesh ensures that communication among containerized and often ephemeral application infrastructure services is fast, reliable, and secure. The mesh provides critical capabilities including service discovery, load balancing, encryption, observability, traceability, authentication and authorization, and support for the circuit breaker pattern.

The service mesh is usually implemented by providing a proxy instance, called a sidecar, for each service instance. Sidecars handle interservice communications, monitoring, and security‑related concerns – indeed, anything that can be abstracted away from the individual services. This way, developers can handle development, support, and maintenance for the application code in the services; operations teams can maintain the service mesh and run the app."
Homomorphic Encryption,Assess,Techniques,TRUE,"Fully homomorphic encryption (HE) refers to a class of encryption methods that allow computations (such as search and arithmetic) to be performed directly on encrypted data. The result of such a computation remains in encrypted form, which at a later point can be decrypted and revealed. Although the HE problem was first proposed in 1978, a solution wasn't constructed until 2009. With advances in computing power and the availability of easy-to-use open-source libraries — including SEAL, Lattigo, HElib and partially homomorphic encryption in Python — HE is becoming feasible in real-world applications. The motivating scenarios include privacy-preserving use cases, where computation can be outsourced to an untrusted party, for example, running computation on encrypted data in the cloud, or enabling a third party to aggregate homomorphically encrypted intermediate federated machine learning results. "
Continuous delivery for machine learning (CD4ML),Assess,Techniques,TRUE,"Continuous Delivery for Machine Learning (CD4ML) is a software engineering approach in which a cross-functional team produces machine learning applications based on code, data, and models in small and safe increments that can be reproduced and reliably released at any time, in short adaptation cycles."
Ethical bias testing,Assess,Techniques,,"There is rising concern that machine learning and deep neural networks in particular could cause unintentional harm. For example, a model could be trained inadvertently to make profitable credit decisions by simply excluding disadvantaged applicants. Ethical bias testing can help uncover potentially harmful decisions in these models. 
Tools such as lime, AI Fairness 360 or What-If Tool can help uncover inaccuracies that result from underrepresented groups in training data and visualization tools such as Google Facets or Facets Dive can be used to discover subgroups within a corpus of training data."
Micro frontends,Assess,Techniques,TRUE,Micro frontends are a new pattern where web application UIs (front ends) are composed from semi-independent fragments that can be built by different teams using different technologies. Micro-frontend architectures resemble back-end architectures where back ends are composed from semi-independent microservices.
Privacy-preserving record linkage (PPRL) using Bloom Filters,Assess,Techniques,TRUE,"Privacy-preserving record linkage (PPRL) using Bloom filter (a space-efficient probabilistic data structure) is an established technique that allows probabilistic linkage of records from different data providers without exposing privately identifiable personal data. For example, when linking data from two data providers, each provider encrypts its personally identifiable data using Bloom filter to get cryptographic linkage keys and then sends them to you via a secure channel. Once data is received, the records can be linked by computing similarity scores between sets of cryptographic linkage keys from each provider."
Automated machine learning (AutoML),Assess,Techniques,TRUE,"Automated machine learning (AutoML) is the process of automating the tasks of applying machine learning to real-world problems. AutoML covers the complete pipeline from the raw dataset to the deployable machine learning model. AutoML was proposed as an artificial intelligence-based solution to the ever-growing challenge of applying machine learning. The high degree of automation in AutoML allows non-experts to make use of machine learning models and techniques without requiring them to become experts in machine learning. Automating the process of applying machine learning end-to-end additionally offers the advantages of producing simpler solutions, faster creation of those solutions, and models that often outperform hand-designed models. AutoML has been used to compare the relative importance of each factor in a prediction model"
Hierachical multi-tenancy,Assess,Techniques,TRUE,"Designing security model for multi-tenancy applications is challenging, especially when we develop a cloud-based system that must support hierarchical users, multiple access levels and hierarchical service data. In this paper, we present hierarchical multi-tenant pattern to model hierarchical multi-tenancy and security aspects (hierarchical data authentication and authorization) of a cloud-based software system. This pattern proposes a consistent and flexible blueprint to manage multiple tenants, security and service data that require hierarchy based on real world scenarios. "
"Managing state using config management tools (Chef, Ansible etc)",Hold,Techniques,TRUE,"""Handcranking"" of Hadoop clusters happens when using config management tools such as Ansible, Chef and others. Although these tools are great at provisioning immutable infrastructure components, they're not very useful when you have to manage stateful systems and can often lead to significant effort trying to manage and evolve clusters using these tools."
Legacy migration feature parity,Hold,Techniques,TRUE,"When planning to migrate a legacy service to an updated services, we should resist marking every feature in the leagcy service a requirement for migraiton. Rather the need for each feature needs to be examined individually and only ported in to the new services if there is sufficient value in doing so. "
Consumer-driven Contract Testing,Hold,Techniques,TRUE,"Contract testing is a methodology for ensuring that two separate systems (such as two microservices) are compatible and are able to communicate with one other. It captures the interactions that are exchanged between each service, storing them in a contract, which can then be used to verify that both parties adhere to it. Contract testing goes beyond schema testing, requiring both parties to come to a consensus on the allowed set of interactions and allowing for evolution over time."
Event Sourcing,Trial,Techniques,TRUE,"Event sourcing refers to a collection of patterns based on persisting the full history of a domain as a sequence of “events”, rather than persisting just the current state. Events are stored as immutable pieces of data that record what event happened, along with any data that is relevant to that event. Events are stored in streams, with a stream of events representing the entire history of a particular entity (or Aggregate in DDD terminology). These event streams are the source of truth for the state of the aggregate.
See CQRS, Kafka for related items."
The three Rs of security,Trial,Techniques,TRUE,"The three Rs of enterprise security — rotate, repair and repave — take advantage of infrastructure automation and continuous delivery to eliminate opportunities for attack. Rotating credentials, applying patches as soon as they're available and rebuilding systems from a known, secure state — all within a matter of minutes or hours — makes it harder for attackers to succeed."
CQRS,Trial,Techniques,TRUE,"The Command and Query Responsibility Segregation (CQRS) pattern separates read and update operations for a data store. Implementing CQRS can maximize performance, scalability, and security. The flexibility created by migrating to CQRS allows a system to better evolve over time and prevents update commands from causing merge conflicts at the domain level."
